75616,2988400,The Yak Who Yelled Yuck (AlphaTales Y),Carol Pugliano-Martin,0439165482,3.85,2001,2,1,Scholastic,5:7,4:11,3:6,2:1,1:1,total:26,2,eng,16.0,"A young yak thinks new foods out yucky until she learns a yummy lesson. Kids will shout ""Yippee"" when you share this engaging tale that teaches the letter Y. AlphaTales are humorous stories designed to help young children recognize letters and the sounds they make. Lay the foundation for reading success with these kid-pleasing books-one for each letter of the alphabet.",,
4818,1639088,Passion for the Possible: A Spirituality of Hope for the New Millennium,Daniel J. O'Leary,1856072355,4.75,1998,1,12,Columba Press (IE),5:3,4:1,3:0,2:0,1:0,total:4,2,eng,,"There is disillusionment, confusion and anger in the hearts of many people in the face of a closed, dry, and dogmatic ecclesiastical attitude. And yet, there are undeniable signs of hope in the hearts of God's people for a new spirituality and for a renewed theology to go with it. They are drawn by the possibilities for spiritual growing, for fresh visions, for imaginative networking. Their hearts confirm the original vision of the creative Holy Spirit - a vision that is currently being rediscovered within the truest tradition of the Catholic faith. The amazing but orthodox theology of revelation that underpins this book will bring hope and joy to many bewildered and despondent Christian hearts.",294.0,2.0
97991,3110677,"Romani in Contact: The History, Structure and Sociology of a Language (Current Issues in Linguistic Theory)",Yaron Matras,9027236291,4.0,1995,6,1,John Benjamins Publishing Company,5:0,4:1,3:0,2:0,1:0,total:1,0,eng,208.0,"A language of Indic origin heavily infuenced by European idioms for many centuries now, Romani provides an interesting experimental field for students of language contact, linguistic minorities, standardization, and typology. Approaching the language via its ever-surfacing character as a language in contact, the volume gives expression to part of the wide range or research represented in today's field of Romani linguistics. Contributions focus on problems in typological change and structural borrowing, lexical borrowing and lexcial reconstruction, the Iranian influence on the language, interdialectal interference, language mixing, Romani influences on slang and argot, grammatical categories in discourse, standardization and literacy in a multilingual community, and plagiarism of data in older sources. The authors discuss dialects spoken in the Czech and Slovak Republics, Serbia, Macedonia, Germany, Poland, and Romania, as well as related varieties in Spain and the Middle East.",,
84221,920766,The Vagrants,Yiyun Li,0007196644,3.87,2009,5,2,Fourth Estate,5:854,4:1440,3:812,2:181,1:43,total:3330,4,eng,,"Brilliant and illuminating, this astonishing debut novel by the award-winning writer Yiyun Li is set in China in the late 1970s, when Beijing was rocked by the Democratic Wall Movement, an anti-Communist groundswell designed to move China beyond the dark shadow of the Cultural Revolution toward a more enlightened and open society. In this powerful and beautiful story, we follow a group of people in a small town during this dramatic and harrowing time, the era that was a forebear of the Tiananmen Square uprising.<br /><br />Morning dawns on the provincial city of Muddy River. A young woman, Gu Shan, a bold spirit and a follower of Chairman Mao, has renounced her faith in Communism. Now a political prisoner, she is to be executed for her dissent. Her distraught mother, determined to follow the custom of burning her only child’s clothing to ease her journey into the next world, is about to make another bold decision. Shan’s father, Teacher Gu, who has already, in his heart and mind, buried his rebellious daughter, begins to retreat into memories. Neither of them imagines that their daughter’s death will have profound and far-reaching effects, in Muddy River and beyond.<br /><br />In luminous prose, Yiyun Li weaves together the lives of these and other unforgettable characters, including a serious seven-year-old boy, Tong; a <br />crippled girl named Nini; the sinister idler Bashi; and Kai, a beautiful radio news announcer who is married to a man from a powerful family. Life in a world of oppression and pain is portrayed through stories of resilience, sacrifice, perversion, courage, and belief. We read of delicate moments and acts of violence by mothers, sons, husbands, neighbors, wives, lovers, and more, as Gu Shan’s execution spurs a brutal government reaction.<br /><br />Writing with profound emotion, and in the superb tradition of fiction by such writers as Orhan Pamuk and J. M. Coetzee, Yiyun Li gives us a stunning novel that is at once a picture of life in a special part of the world during a historic period, a universal portrait of human frailty and courage, and a mesmerizing work of art.",337.0,4.0
26118,1082847,The Man Who Killed His Brother,Stephen R. Donaldson,0345335384,3.62,1980,12,11,Ballantine Books,5:75,4:161,3:152,2:29,1:9,total:426,1,eng,,"Reed Stephens:a pseudonym used by Stephen R. Donaldson.<br />Mick ""Brew"" Axbrewder was once a great P.I. That was before he accidentally shot and killed a cop-worse, a cop who happened to be his own brother. Now he only works now and then, as muscle for his old partner, Ginny Fistoulari. It's a living. And it provides an occasional opportunity for him to dry out.",187.0,1.0
44468,849880,Hell's Angels,Hunter S. Thompson,0345331486,3.97,1985,12,8,Ballantine Books (NY),5:12863,4:17448,3:9119,2:1805,1:492,total:41727,39,en-US,,"""California, Labor Day weekend...early, with ocean fog still in the streets, outlaw motorcyclists wearing chains, shades &amp; greasy Levis roll out from damp garages, all-night diners &amp; cast-off one-night pads in Frisco, Hollywood, Berdoo &amp; East Oakland, heading for the Monterey peninsula, north of Big Sur...The Menace is loose again."" Thus begins Hunter S. Thompson's vivid account of his experiences with California's most notorious motorcycle gang, the Hell's Angels.<br /><br /> In the mid-60s, Thompson spent almost two years living with the controversial Angels, cycling up &amp; down the coast, reveling in the anarchic spirit of their clan, and, as befits their name, raising hell. His book successfully captures a singular moment in American history, when the biker lifestyle was 1st defined, &amp; when such countercultural movements were electrifying &amp; horrifying America. Thompson, the creator of Gonzo journalism, writes with his usual bravado, energy &amp; brutal honesty, &amp; with a nuanced &amp; incisive eye; as The New Yorker pointed out, ""For all its uninhibited &amp; sardonic humor, Thompson's book is a thoughtful piece of work."" As illuminating now as when originally published in '67, Hell's Angels is a gripping portrait, the best account we have of the truth behind an American legend.",348.0,39.0
76664,1725399,Talking Heads,Alan Bennett,184607259X,4.28,2007,5,7,BBC Books,5:731,4:500,3:201,2:39,1:13,total:1484,68,eng,,Talking Heads is a series of dramatic monologues written for BBC television by British playwright Alan Bennett and later published as a series of books.,266.0,
79171,1802466,"A Question of Proof (Nigel Strangeways, #1)",Nicholas Blake,0792704460,3.7,1990,10,28,John Curley & Associates,5:125,4:202,3:165,2:34,1:18,total:544,46,eng,338.0,"The faculty and student body at Sudeley are shocked but scarcely saddened when the headmaster’s obnoxious nephew, Algernon Wyvern-Wemyss, is found dead in a haystack on Sports Day. <br /><br />But when the young English master, Michael Evans, becomes a suspect in the case, he’s greatly relieved when his clever friend Nigel Strangeways, who is beginning to make a name for himself as a private inquiry agent, shows up to lend a hand to the local constabulary. <br /><br />Strangeways immediately wins over the students and even becomes an initiate in one of their secret societies, The Black Spot, whose members provide him with some of the information he needs to solve the case. <br /><br />In the meantime Michael and Hero Vale, the pretty young wife of the headmaster, continue their hopeless love affair. When another murder follows, Strangeways is soon certain of the murderer’s identity, but until he can prove it, he’s reluctant to share his theory with the unimaginative but thorough Superintendent Armstrong. <br /><br />Published in 1935 while he was a schoolmaster himself, this is the first detective novel by C. Day-Lewis, the noted man of letters who went on to become England’s poet laureate.",,
19272,672335,Beethoven: Studies in the Creative Process,Lewis Lockwood,0674063627,4.0,1992,1,4,Harvard University Press,5:0,4:2,3:0,2:0,1:0,total:2,0,eng,,"It is well known that Mozart developed his works in his head and then simply transcribed them onto paper, while Beethoven labored assiduously over sketches and drafts--""his first ideas,"" in Stephen Spender's words, ""of a clumsiness which makes scholars marvel at how he could, at the end, have developed from them such miraculous results."" Indeed Beethoven's extensive sketchbooks (which total over 8,000 pages) and the autograph manuscripts, covering several stages of development, reveal the composer systematically exploring and evolving his musical ideas. Through close investigation of individual works, Lewis Lockwood traces the creative process as it emerges in Beethoven's sketches and manuscripts. Four studies address the composition of the ""Eroica"" Symphony from various viewpoints. The chamber works discussed include the Cello Sonata in A Major, Opus 69 (of which the entire autograph manuscript of the first movement is published here in facsimile), the string quartet Opus 59 No. 1, and the Cavatina of the later quartet Opus 130. Lockwood's lucid analysis enhances our understanding of Beethoven's musical strategies and stylistic developments as well as the compositional process itself In a final chapter the author outlines the importance of Beethoven's autographs for the modern performer.",283.0,
64539,2523448,A Mother in the Making,Lilian Darcy,0373248806,3.19,2008,1,29,Silhouette Special Edition,5:5,4:4,3:11,2:5,1:2,total:27,4,eng,248.0,"UNEXPECTEDLY EXPECTING!<br /><br />Carmen O'Brien has a lot on her plate --- including raising her orphaned siblings. And if that isn't enough, a gorgeous, sexy new man has just entered her life --- Jack Davey.<br /><br />But who has time for gorgeous, sexy new men? It's fantastic to have a bit of fun for a change, but Carmen has to put family first.<br /><br />Except then she discovers she's bound to Jack for good. She might have been a mom in the making for years, but Carmen is to become a mom for real in nine months' time --- and she needs Jack more than ever...""",,
89177,997117,Hell to Pay,George Pelecanos,0316695068,3.88,2002,27,2,"Little, Brown and Company",5:584,4:1210,3:623,2:90,1:26,total:2533,13,eng,,"Derek Strange and Terry Quinn, the team of private investigators who made their stunning debut in Right As Rain, are hired to find a 14-year-old white girl from the suburbs who's run away from home and is now working as a prostitute. The two ex-cops think they know D.C.'s dangers, but nothing in their experience has prepared them for Worldwide Wilson, the pimp whose territory they're intruding upon.<br /><br />Combining inimitable neighborhood flavor, action scenes that rank among the best in fiction, and a clear-eyed view of morality in a world with few rules, ""Hell to Pay"" is another Pelecanos masterpiece for his ever-expanding audience to savor.",352.0,13.0
60845,2393511,Seven Come Infinity,Groff Conklin,4049017520,4.0,1966,1,1,Fawcett Publications,5:8,4:11,3:8,2:0,1:0,total:27,4,eng,288.0,"Seven superb tales of possible worlds where...<br />television covers the inhuman side of the news;<br />ingenious social planning makes every man a dictator;<br />computerized brain repair proves too successful;<br />spaceships vanish in the fourth dimension;<br />the competition for habitable planets inspires an interstellar hoax;<br />peculiar bugs appear and things, literally, begin to fall apart;<br />a highly developed society exists without the clutter of technology.<br /><br />Carefully selected and edited by Groff Conklin, each of these stories represents the work of a master in the field. Taken together they make a collection of great diversity, imagination and creativity, especially designed for the connoisseur of science fiction.<br /><br />Contents:<br /><br />Preface • essay by Groff Conklin <br />The Golden Bugs • (1960) • novelette by Clifford D. Simak <br />Special Feature • (1958) • novelette by Charles V. De Vet <br />Panic Button • (1959) • shortstory by Eric Frank Russell <br />Discontinuity • (1950) • novelette by Raymond F. Jones <br />The Corianis Disaster • (1960) • novella by Murray Leinster <br />The Servant Problem • (1955) • novelette by William Tenn <br />Rite of Passage • (1954) • novelette by Chad Oliver",,
30333,1378138,The Around the World Coobook,Linda Fraser,0754802566,4.1,2000,1,9,Anness Publishing,5:11,4:13,3:6,2:1,1:0,total:31,5,eng,,The Around the World Cookbook is a great opportunity to sample some of the world''s favourite dishes. This chapter-by-chapter tour of the world includes over 350 authentic and flavoursome recipes in their own diversity.',512.0,5.0
79175,1802563,Dr Jekyll and Mr Hyde (Longman Classics),D.K. Swan,0582018188,3.55,1991,4,1,Addison Wesley Publishing Company,5:0,4:6,3:5,2:0,1:0,total:11,1,eng,57.0,"This is a Stage 3 title in a series which contains some of the best classic stories retold in English. The series is graded in four stages: Stage 1 - 500 word vocabulary, Stage 2 - 750, Stage 3 - 1300 and Stage 4 - 1800. Each book includes an introduction to the author and story, a glossary of new words and exercise material (comprehension and discussion questions).",,
28473,1334382,Stiffed: The Betrayal of the American Man,Susan Faludi,068812299X,3.88,1999,22,9,William Morrow,5:258,4:390,3:211,2:47,1:21,total:927,11,eng,,"One of the most talked-about books of last year, the Pulitzer Prize-winning author of <em>Backlash</em> now explores the collapse of traditional masculinity that has left men feeling betrayed. With <em>Backlash</em> in 1991, Susan Faludi broke new ground when she put her finger directly on the problem bedeviling women, and the light of recognition dawned on millions of her readers: what's making women miserable isn't something they're doing to themselves in the name of independence. It's something our society is doing to women. The book was nothing less than a landmark. Now in <em>Stiffed,</em> the author turns her attention to the masculinity crisis plaguing our culture at the end of the '90s, an era of massive layoffs, ""Angry White Male"" politics, and Million Man marches. As much as the culture wants to proclaim that men are made miserable--or brutal or violent or irresponsible--by their inner nature and their hormones, Faludi finds that even in the world they supposedly own and run, men are at the mercy of cultural forces that disfigure their lives and destroy their chance at happiness. As traditional masculinity continues to collapse, the once-valued male attributes of craft, loyalty, and social utility are no longer honored, much less rewarded. Faludi's journey through the modern masculine landscape takes her into the lives of individual men whose accounts reveal the heart of the male dilemma. <em>Stiffed</em> brings us into the world of industrial workers, sports fans, combat veterans, evangelical husbands, militiamen, astronauts, and troubled ""bad"" boys--whose sense that they've lost their skills, jobs, civic roles, wives, teams, and a secure future is only one symptom of a larger and historic betrayal.",672.0,11.0
82347,1890078,The Reappearance of the Christ,Alice A. Bailey,085330114X,4.15,1948,12,1,Lucis Publishing Company,5:20,4:5,3:4,2:1,1:3,total:33,3,eng,192.0,"Many expect the coming of an Avatar or Saviour. This book presents the second coming of the Christ, as the world Teacher for the age of Aquarius, as an imminent event in the continuity of divine revelation. The Christ belongs to all mankind, and can be known and understood as the same great Identity in all the world religions.",,
36718,1232729,Sailors to the End: The Deadly Fire on the USS Forrestal and the Heroes Who Fought It,Gregory A. Freeman,0060936908,4.34,2004,6,7,William Morrow Paperbacks,5:135,4:102,3:31,2:5,1:0,total:273,1,eng,,"The aircraft carrier USS Forrestal was preparing to launch attacks into North Vietnam when one of its jets accidentally fired a rocket into an aircraft occupied by pilot John McCain. A huge fire ensued, and McCain barely escaped before a 1,000-pound bomb on his plane exploded, causing a chain reaction with other bombs on surrounding planes. The crew struggled for days to extinguish the fires, but, in the end, the tragedy took the lives of 134 men. For thirty-five years, the terrible loss of life has been blamed on the sailors themselves, but this meticulously documented history shows that they were truly the victims and heroes.",307.0,1.0
22125,1012959,The Castle,Franz Kafka,074939952X,3.96,1992,23,1,Vintage Classics,5:14814,4:15656,3:8874,2:2488,1:854,total:42686,17,en-GB,,"<b>'He is the greatest German writer of our time. Such poets as Rilke or such novelists as Thomas Mann are dwarfs or plaster saints in comparison to him' Vladimir Nabokov</b><br /><br />The story of K. and his arrival in a village where he is never accepted, and his relentless, unavailing struggle with authority in order to gain entrance to the castle that seems to rule it. K.'s isolation and perplexity, his begging for the approval of elusive and anonymous powers, epitomises Kafka's vision of twentieth-century alienation and anxiety.",320.0,17.0
102172,3281091,"Tempest-tost (The Salterton Trilogy, #1)",Robertson Davies,0140264345,4.05,1997,9,22,Penguin Canada,5:545,4:748,3:335,2:54,1:7,total:1689,1,en-US,280.0,"amateur production of <i>The Tempest</i> provides a colourful backdrop for an hilarious look at unrequited love. Mathematics teacher Hector Mackilwraith, stirred and troubled by Shakespeare's play, falls in love with the beautiful Griselda Webster. When Griselda shows that she has plans of her own, Hector despairs and tries to commit suicide on the play's opening night.",,
2327,1962492,Battlefields Beyond Tomorrow: Science Fiction War Stories,Robert Silverberg,0517641054,4.11,1987,10,7,Bonanza Books,5:14,4:16,3:3,2:2,1:1,total:36,7,eng,650.0,This anthology contains: Introduction by Robert Silverberg; The Defenders by Philip K. Dick; The Long Watch by Robert A. Heinlein; The Miracle Workers by Jack Vance; Committee of the Whole by Frank Herbert; Superiority by Arthur C. Clarke; Single Combat by Joe Green; Ender's Game by Orson Scott Card; Hero by Joe W. Haldeman; The Survivor by Walter F. Moudy; The Last Objective by Paul Carter; What Do You Want Me to Do to Prove Im Human Stop by Fred Saberhagen; Hangman by David Drake; The Night of the Trolls by Keith Laumer; The Nuptial Flight of Warbirds by Algis Budrys; Mirror Mirror by Alan E. Nourse; Memorial by Theodore Sturgeon; Shark by Edward Bryant; Not a Prison Make by Joseph P. Martino; Hawk Among the Sparrows by Dean McLaughlin; No War or Battle's Sound by Harry Harrison; In the Name of the Father by Edward P. Hughes; On the Shadow of a Phosphor Screen by William F. Wu; The Specter General by Theodore R. Cogswell; Fixed Price War by Charles Sheffield; and The Machine that Won the War by Isaac Asimov.,,
96391,3052564,The Aristocrat,Catherine Coulter,0373093314,3.69,1986,9,1,Silhouette Books,5:335,4:333,3:347,2:106,1:45,total:1166,2,eng,253.0,"What would an American football star do if he suddenly found himself an English lord? It wasn't something pro quarterback Brant Asher had ever bothered to think about --until the day he learned of his inheritance. He was now Viscount Asherwood, heir to an English estate, and a whole lot of trouble.<br /><br />Brant had inherited the obligation to marry Daphne, charitably described to him as an ugly duckling. This wasn't an attractive prospect for a man who enjoyed the pleasures of bachelor life--until he met the lady in question. Her reputation was obviously undeserved, because this was no ugly duckling; this was a beautiful swan.",,
93170,1165710,Ruddigore,W.S. Gilbert,0881887277,3.78,1986,1,11,"G. Schirmer, Inc.",5:14,4:17,3:20,2:3,1:0,total:54,3,eng,,Vocal ScoreComplete vocal score.,224.0,3.0
39179,1280983,True Names,Vernor Vinge,0312944446,3.9,1984,15,12,Bluejay Books,5:117,4:180,3:96,2:22,1:7,total:422,44,eng,,"Disaffected computer wizard ""Mr. Slippery"" (True Name Roger Pollack) is an early adopter of a new full-immersion virtual reality technology called the Other Plane. He and the other wizards form a cabal to keep their true identities — their True Names — secret to avoid prosecution by their ""Great Adversary"" — the government of the United States. <br /><br />The lines that define us are not always black and white, though. There's a new wizard in the Other Plan and they're recruiting for a scheme to translate cyberspace domination into real world power.",153.0,44.0
101566,3254309,"Baltimore's Boxing Legacy: 1893-2003, Maryland (Images of Sports)",Thomas Schaif,0738515612,0.0,2003,9,16,Arcadia Publishing (SC),5:0,4:0,3:0,2:0,1:0,total:0,0,eng,128.0,"The boxing history of Baltimore dates back over a century. Over that time the Monumental City has produced seven world champions and numerous top contenders. Joe Gans, the first Baltimorean and African-American ever to win a world title, in 1902, learned his boxing science in the city, earning him the title of ""The Old Master"" while he shucked oysters on Broadway. Baltimore's Boxing Legacy: 1893 to 2003 chronicles the evolution of fistiana from venues such as the Eureka Athletic Club, Gayety Theatre, Lyric Theatre, Carlin's Park, Baltimore Coliseum, Oriole Park, Steelworkers' Hall, to the Civic Center. It is a tale of ethnicity and race, of color barriers broken, and near-champions and contenders remembered. The likes of Johnny Kid Williams, the Dundee brothers Joe and Vince, Benny Schwartz, Jack Portney, Harry Jeffra, Red Burman, Joe Poodles Sr., Mack Lewis, Vincent Pettway, Hasim Rahman, and many more are showcased in addition to trainers, managers, matchmakers, and promoters.",,
5061,1646536,The Sound of Thunder,Wilbur Smith,031294067X,4.17,2007,2,10,St. Martin's Paperbacks,5:3370,4:3368,3:1411,2:181,1:55,total:8385,7,eng,,"<i>The Sound of Thunder</i>, a Courtney Family Adventure by Wilbur Smith<br /><br />The year is 1899. The British Empire is at the height of its power. But in South Africa, proud Dutch colonists defy the Queen and her army--and a lush, wild world is torn apart by guns, spears, and swords.<br /><br />Sean Courtney had been tragically separated from his family, but the Boer War has brought him back to his homeland--and into the sights of his enemy's guns. It has also returned him to Ruth Friedman, the only woman Sean can love, even though he shouldn't. As Sean's loyalties--to nation, man, and blood--are tested, a saga of duty and betrayal unfolds....",496.0,7.0
12060,776434,"Wild Cards (Wild Cards, #1)",George R.R. Martin,0743423801,3.7,2001,1,8,iBooks,5:2535,4:4308,3:3193,2:914,1:293,total:11243,9,en-US,,"A shared-universe superhero prose anthology edited by George R.R. Martin.<br /><br />It all began in 1946, when the bizarre, gene-altering Wild Cards virus was unleashed in the skies over New York City. A virus that created superpowered Aces and bizarre, disfigured Jokers. <br /><br />Now, thirty years later, the victims face a new nightmare. From the far reaches of space comes The Swarm, a deadly menace that could very well destroy the planet. Putting aside their hatred and mistrust, Aces and Jokers must form an uneasy alliance and prepare for a battle they must not lose. . . .",426.0,9.0
17078,642169,"Hollywood, Interrupted: Insanity Chic in Babylon — The Case Against Celebrity",Andrew Breitbart,0471706248,3.4,2005,10,3,Wiley,5:46,4:59,3:66,2:32,1:16,total:219,22,eng,,"<i>Hollywood, Interrupted</i> is a sometimes frightening, occasionally sad, and frequently hysterical odyssey into the darkest realms of showbiz pathology, the endless stream of meltdowns and flameouts, and the inexplicable behavior on the part of show business personalities. Charting celebrities from rehab to retox, to jails, cults, institutions, near-death experiences and the Democratic Party, <i>Hollywood, Interrupted</i> takes readers on a surreal field trip into the amoral belly of the entertainment industry. Each chapter -- covering topics including warped Hollywood child-rearing, bad medicine, hypocritical political maneuvering and the complicit media -- delivers a meticulously researched, interview-infused, attitude heavy dispatch which analyzes and deconstructs the myths created by the celebrities themselves.<br /><br />Celebrities somehow believe that it's their god-given right to inflict their pathology on the rest of us. <i>Hollywood, Interrupted</i> illustrates how these dysfunctional dilettantes are mad as hell... And we're not going to take it any more.",394.0,
