,Id,Name,Authors,ISBN,Rating,PublishYear,PublishMonth,PublishDay,Publisher,RatingDist5,RatingDist4,RatingDist3,RatingDist2,RatingDist1,RatingDistTotal,CountsOfReview,Language,PagesNumber,Description,pagesNumber,Count of text reviews
54015,2167181,"The Spellman Files (The Spellmans, #1)",Lisa Lutz,1847820069,3.88,2007,12,1,Charnwood (U.K.),5:9141,4:12530,3:7346,2:1783,1:653,total:31453,9,eng,434.0,"Meet Isabel ""Izzy"" Spellman, private investigator. This twenty-eight-year-old may have a checkered past littered with romantic mistakes, excessive drinking, and creative vandalism; she may be addicted to Get Smart reruns and prefer entering homes through windows rather than doors -- but the upshot is she's good at her job as a licensed private investigator with her family's firm, Spellman Investigations. Invading people's privacy comes naturally to Izzy. In fact, it comes naturally to all the Spellmans. If only they could leave their work at the office. To be a Spellman is to snoop on a Spellman; tail a Spellman; dig up dirt on, blackmail, and wiretap a Spellman. <br /><br />Part Nancy Drew, part Dirty Harry, Izzy walks an indistinguishable line between Spellman family member and Spellman employee. Duties include: completing assignments from the bosses, aka Mom and Dad (preferably without scrutiny); appeasing her chronically perfect lawyer brother (often under duress); setting an example for her fourteen-year-old sister, Rae (who's become addicted to ""recreational surveillance""); and tracking down her uncle (who randomly disappears on benders dubbed ""Lost Weekends""). <br /><br />But when Izzy's parents hire Rae to follow her (for the purpose of ascertaining the identity of Izzy's new boyfriend), Izzy snaps and decides that the only way she will ever be normal is if she gets out of the family business. But there's a hitch: she must take one last job before they'll let her go -- a fifteen-year-old, ice-cold missing person case. She accepts, only to experience a disappearance far closer to home, which becomes the most important case of her life.",,
96931,3069617,Insight Day and Night Guide Boston,Insight Guides,9812468013,4.0,2006,7,15,Insight Guides,5:0,4:1,3:0,2:0,1:0,total:1,1,eng,1.0,"Insight Day &amp; Night Guides let you plan your daily itinerary with reliable information that will make your way easy. Expert recommendations and reviews of top 10 sights help you visit a museum, shop or sightsee in the day and paint the town red at night.",,
105559,3430781,"Sixteen Candles (Terror Academy, #3)",Nicholas Pine,0749716886,3.6,1994,6,13,Mammoth,5:12,4:27,3:18,2:9,1:1,total:67,0,eng,174.0,"<b>TERROR ACADEMY - A KILLER IS ON THE LOOSE...</b><br /><br />Since her parents' mysterious deaths, Kelly Langdon has lived a life of misery with her Aunt Doris. Shy and overweight, she's the favorite target of the bullies at Central. But as she turns sixteen, Kelly blossoms into the most popular girl at school. Everything starts to go her way. Except for the strange messages and threats. And soon she realizes that they mean what they say...",,
75202,2971345,His Wedding Ring of Revenge,Julia James,0263185966,3.52,2005,12,2,Thorndike Press,5:52,4:59,3:71,2:30,1:9,total:221,1,eng,288.0,"Rachel Vail is still haunted by Vito Farneste's cruel public rejection of her, but she desperately needs a marriage of convenience. Only Vito won't be blackmailed by anyone. Rachel will be wearing his ring--but it will be his wedding ring of revenge!",,
89816,1108028,All for the Union: The Civil War Diary & Letters of Elisha Hunt Rhodes,Robert Hunt Rhodes,0679738282,4.12,1992,28,7,Vintage,5:303,4:247,3:129,2:32,1:9,total:720,30,eng,,"All for the Union is the eloquent and moving diary of Elisha Hunt Rhodes, who enlisted into the Union Army as a private in 1861 and left it four years later as a 23-year-old lieutenant colonel after fighting hard and honorably in battles from Bull Run to Appomattox. Anyone who heard these diaries excerpted on the PBS-TV series The Civil War will recognize his accounts of those campaigns, which remain outstanding for their clarity and detail. Most of all, Rhodes's words reveal the motivation of a common Yankee foot soldier, an otherwise ordinary young man who endured the rigors of combat and exhausting marches, short rations, fear, and homesickness for a salary of $13 a month and the satisfaction of giving ""all for the union.""",270.0,30.0
104815,3400827,"The Legacy (The Legacy, #1)",T.J. Bennett,1933836369,3.51,2008,4,1,Medallion Press,5:24,4:41,3:43,2:16,1:4,total:128,11,eng,455.0,"When her brief, disastrous marriage to a fortune hunter ends in scandal, Baronesse Sabina von Ziegler's vengeful adoptive father imprisons her in a cloister. Nine years later, however, following the teachings of the reformer Martin Luther, she arranges a daring escape. She is free at last—for the moment—a noblewoman of conscience, and has learned a lesson about trusting men she will never forget.<br /><br />Wolfgang Behaim, a widowed commoner, is a tradition-bound printer from the rising middle class with a secret that threatens to destroy everything he holds dear. Burdened by the mysterious circumstances surrounding his father's death, he has no heart for love. Yet he finds himself suddenly betrothed to Sabina, the Baron von Ziegler's adopted daughter.<br /><br />It is a marriage neither wants. Sabina again finds herself imprisoned by the Baron, in a dungeon this time, being slowly starved to death. Her only key to freedom is marriage to Wolf. And Wolf must marry Sabina, or the murderous Baron will reveal the secret from his past.<br /><br />Though neither comprehends the dark purpose behind the Baron's machinations, they are forced into a union they never plan to consummate. But as they fight to discover the truth of the mysteries surrounding them, they find themselves challenged by a fiery passion they cannot resist. Can they overcome their past and find love even as lies, war, and an unexpected enemy conspire against them?",,
2685,1974029,"The Dead of Night (The Tomorrow Series, #2)",John Marsden,0395837340,4.14,1997,9,29,Houghton Mifflin Company,5:7405,4:8515,3:3519,2:454,1:84,total:19977,15,eng,278.0,"Australia has been invaded. Nothing is as it was. Six teenagers are living out their nightmare in the sanctuary of a hidden valley called Hell. Alone, they make their own rules, protect what is theirs, and struggle for courage and hope in a world changed forever. Seeking supplies, allies, and information, the friends make forays into enemy territory, drawing on nerve and resourcefulness they never even knew they had. As the risks become greater, so too do the sacrifices they must make. Intense, passionate, and compulsive, The Dead of Night continues the frighteningly real story begun in Tomorrow, When the War Began.",,
56497,2238834,Love and Biology at the Center of the Universe,Jennie Shortridge,0451223888,3.41,2008,5,6,Berkley Books,5:97,4:169,3:231,2:72,1:23,total:592,89,eng,367.0,"When she learns that her college sweetheart husband has been seeing another woman, Mira Serafino's perfect world is shattered and she wants no one, least of all her big Italian family, to know. She heads north-with no destination and little money- stopping only when her car breaks down in Seattle. She takes a job at the offbeat Coffee Shop at the Center of the Universe, where she'll experience a terrifying but invigorating freedom, and meet someone she'll come to love: the new Mira.",,
117988,4838239,Flyboy,Nicole  Austin,1419917161,4.08,2008,7,25,Ellora’s Cave,5:5,4:3,3:4,2:0,1:0,total:12,3,eng,204.0,"Out of Print<br /><br /><i>""A book in The Hussies series.""</i><br /><br />Take an ancient Hussy warrior hunter with a Scottish castle that changes before your eyes. <br /><br />Mix in a computer geek with a wild imagination, an unemployed biker scarred by the past, and task them with saving the world. <br /><br />Add a dash of freaky past-life regression along with some cool spy stuff and you've got one heck of a recipe for adventure. They just may succeed at their mission - stranger things have happened. <br /><br />However, the consequences are deadly and failure is not an option for Twyla or Jhett. <br /><br />Surviving the seedy underworld of weapons dealers requires learning to trust each other if they're to have any chance at breaking the endless cycle of repeating their mistakes.over and over.in one life after another.<br />",,
113315,4413662,Beach Management,Eric C.F. Bird,0471963372,1.0,1996,9,12,Wiley,5:0,4:0,3:0,2:0,1:1,total:1,1,eng,281.0,"Beach Management Eric C. F. Bird Geostudies Beach Management is the latest book in the Coastal Morphology and Research Series, and deals with the origin of beaches, the processes at work on them, the causes of beach erosion and accretion, and the ways in which the coast has been modified by anti-erosion structures. The emplacement of artificial bleaches, and the use and development of beaches for recreation is also covered. This volume provides background for those concerned with planning and management of the coast (particularly where there are problems of erosion and beach maintenance), beach usage and recreational development. It also provides information and case studies for courses in coastal management.<br /><br />Ch. 1. The origin of beach sediments<br />Ch. 2. Beach processes and morphology<br />Ch. 3. Causes of beach erosion<br />Ch. 4. Structures for beach protection<br />Ch. 5. Beach nourishment<br />Ch. 6. Beach use and management",,
52371,2115046,"The Well of Ascension (Mistborn, #2)",Brandon Sanderson,0765356139,4.37,2008,6,3,Tor Fantasy,5:141311,4:100200,3:28207,2:4366,1:1220,total:275304,1377,eng,763.0,"They did the impossible, deposing the godlike being whose brutal rule had lasted a thousand years. Now Vin, the street urchin who has grown into the most powerful Mistborn in the land, and Elend Venture, the idealistic young nobleman who loves her, must build a healthy new society in the ashes of an empire.<br /><br />They have barely begun when three separate armies attack. As the siege tightens, an ancient legend seems to offer a glimmer of hope. But even if it really exists, no one knows where to find the Well of Ascension or what manner of power it bestows.<br /><br />It may just be that killing the Lord Ruler was the easy part. Surviving the aftermath of his fall is going to be the real challenge.",,
40737,809171,How To Talk to Anybody About Anything: Breaking the Ice With Everyone from Accountants to Zen Buddhists,Leil Lowndes,0806520779,3.24,2000,1,6,Citadel,5:8,4:10,3:21,2:6,1:4,total:49,2,eng,,"Reveals the most appropiate, provocative, and specific questions to ask members of specific groups, such as ballroom dancers, cosmetic surgeons, and tennis players, in order to communicate effectively.",320.0,2.0
29848,1367775,"The MacGregor Trilogy: MacGregor's Gathering / The Clansman / Gold for Prince Charlie (MacGregor, #1-3)",Nigel Tranter,0340405724,4.29,1996,1,12,Coronet Books (GB),5:14,4:12,3:5,2:0,1:0,total:31,1,eng,,"From 1706 to 1745, this trilogy charts the story of Rob Roy MacGregor and his gallant nephew, Gregor, both fierce opponents of their rulers' plan to unite the Scottish and English parliaments. Contains ""MacGregor's Gathering""; ""The Clansman""; and ""Gold for Prince Charlie"".",252.0,1.0
50322,2053903,"The Point Of Rescue (Spilling CID, #3)",Sophie Hannah,0340933100,3.49,2008,1,1,Hodder & Stoughton,5:1166,4:2908,3:2879,2:837,1:237,total:8027,85,en-GB,416.0,Bestselling author Sophie Hannah explores the various sides of motherhood in her third psychological suspense novel.,,
112099,4293954,Contacts,Jean-Paul Valette,0618395784,3.83,2007,12,1,Houghton Mifflin,5:12,4:10,3:10,2:1,1:2,total:35,4,eng,531.0,"Applauded for its superior grammar sequencing, four-skills presentation and practice, vocabulary control, and supportive pedagogy, CONTACTS remains one of the most popular Introductory French programs available. Now in its Eighth Edition, the program continues to reflect the realities of the contemporary French and Francophone worlds and to serve the communication needs of the new millennium. Its hallmark strengths--highly effective logical progression, clear organization, and supportive pedagogy--which have served more than half a million CONTACTS users.",,
32631,1536012,"Spencer's Forbidden Passion (The Westmorelands, #11)",Brenda Jackson,0373768389,4.28,2007,4,12,Silhouette Desire,5:539,4:298,3:144,2:36,1:11,total:1028,25,eng,,"YOU HAVE FORTY-EIGHT HOURS TO BE MY WIFE.<br /><br />Millionaire deal-maker Spencer Westmoreland would bail out Chardonnay Russell's failing Napa Valley vineyard. And in return she'd bear his children. But she shouldn't dare hope Spencer would ever fall in love with her.<br /><br />Her only choice was to accept the arrogant businessman's proposal. But becoming Spencer's wife--in every way--set her body, her heart, on fire. And soon Chardonnay wanted what was strictly forbidden....",183.0,25.0
85171,935995,Taking Sides: Clashing Views on Controversial Environmental Issues,Thomas A. Easton,0073514411,3.44,2005,31,10,McGraw-Hill/Contemporary,5:18,4:20,3:25,2:13,1:4,total:80,3,eng,,"Includes two controversial issues in a debate-style format designed to stimulate student interest and develop critical thinking skills. This book contains issuees framed with an issue summary, an issue introduction, and a postscript. It features an annotated listing of selected World Wide Web sites.",432.0,3.0
59298,2334212,A New Basis For The Metric Theory Of Congruences,Levi Stephen Shively,1418177563,0.0,2005,12,20,"Scholarly Publishing Office, University of Michigan Library",5:0,4:0,3:0,2:0,1:0,total:0,0,eng,35.0,"Excerpt from A New Basis for the Metric Theory of Congruences: A Dissertation Submitted to the Faculty of the Ogden Graduate School of Science in Candidacy for the Degree of Doctor of Philosophy, Department of Mathematics <br />In the classical theory of rectilinear congruences as developed by Kummer, the analysis is based upon two fundamental quadratic forms, formed from the expressions for the coordinates of the surface of reference and from the spherical representation of the congruence. Thus, when studied by this method, the congruence is in reality defined by its relation to two surfaces. Important results of the Kummer theory are the existence of the two focal surfaces and of two one-parameter families of developables. These results have been used by Wilczynski as the basis of his general projective theory of congruences. In the present paper also, the focal surfaces will be regarded as known by means of a parametric representation, such that the ruled surfaces u = const, and v = const, of the congruence are its developables. <br />The first section is devoted to the introduction of certain local coordinate systems, all closely related to the general line of the congruence. These coordinate systems are used to study the properties of the congruence in the neighborhood of one of its lines, as well as the properties of its Laplacian transforms. Homogeneous cartesian coordinates are introduced in the second section and the equations (D) of the Wilczynski theory are derived.",,
114648,4538410,Daily Life of the Ancient Egyptians (The Greenwood Press Daily Life Through History Series),Bob Brier,0313353069,3.94,2008,9,1,Greenwood,5:44,4:68,3:47,2:3,1:0,total:162,4,eng,311.0,"Explore the daily lives of ancient Egyptians in this exciting new update of one of the most successful Daily Life titles. Through reconstructions based on the hieroglyphic inscriptions, paintings from tombs, and scenes from temple walls, readers can examine social and material existence in one of the world's oldest civilizations. Narrative chapters explore the preparation of food and drink, religious ceremonies and cosmology, work and play, the arts, military domination, and intellectual accomplishments. With material garnered from recent excavations and research, including new content on construction, pyramid building, ship building, and metallurgy, this up-to-date volume caters to the ever-evolving needs of today's readers. A timeline, an extensive research center bibliography, and over 20 new photos make this a must-have reference source for modern students of ancient history.<br /><br /><br /><br />Explore the daily lives of ancient Egyptians in this exciting update of one of the most successful Daily Life titles. Through reconstructions based on the hieroglyphic inscriptions, paintings from tombs, and scenes from temple walls, readers can explore social and material existence in one of the world's oldest civilizations. Narrative chapters explore the preparation of food and drink, religious ceremonies and cosmology, work and play, the arts, military domination, and intellectual accomplishments.<br /><br /><br /><br />With information garnered from recent excavations and research, including new content on construction, pyramid building, ship building, and metallurgy, this up-to-date volume caters to the ever-evolving needs of today's readers. A timeline, an extensive research center bibliography, and over 20 new photos make this a must-have reference source for modern students of ancient history.",,
109932,4055855,Computer Design and Architecture,Sajjan G. Shiva,0824703685,0.0,2000,5,15,CRC,5:0,4:0,3:0,2:0,1:0,total:0,0,eng,718.0,"This unique and proven text provides a hands-on introduction to the design of a computer system-depicting, step by step, the arrangement of a simple but complete hypothetical computer followed by detailed architectural features of existing computer systems as enhancements to the structure of the simple computer. <br />Changes in the Third Edition of Computer Design and Architecture include <br />updates to reflect contemporary organizations and devices <br />new technologies and devices in combinatorial and integrated circuits <br />new technologies in sequential circuits <br />new technologies in memory and storage <br />the latest architecture examples <br />contemporary memory hierarchy concepts <p>Ideal for one- or two-semester courses <br />With end-of-chapter summaries, references, and problems, as well as over 250 drawings and tables, Computer Design and Architecture, Third Edition is a classroom-tested text for upper-level undergraduate and graduate students in electrical and computer engineering and computer science taking design courses such as Computer Systems Design, Computer Hardware Design, Computer Architecture, Computer Organization, and Assembly Language Programming.</p>",,
64996,2543380,Bill Bright and Campus Crusade for Christ: The Renewal of Evangelicalism in Postwar America,John G. Turner,0807858730,4.09,2008,3,1,University of North Carolina Press,5:12,4:15,3:4,2:1,1:1,total:33,6,eng,288.0,"Founded as a local college ministry in 1951, Campus Crusade for Christ has become one of the world's largest evangelical organizations, today boasting an annual budget of more than $500 million. Nondenominational organizations like Campus Crusade account for much of modern evangelicalism's dynamism and adaptation to mainstream American culture. Despite the importance of these ""parachurch"" organizations, says John Turner, historians have largely ignored them.<br /><br />Turner offers an accessible and colorful history of Campus Crusade and its founder, Bill Bright, whose marketing and fund-raising acumen transformed the organization into an international evangelical empire. Drawing on archival materials and more than one hundred interviews, Turner challenges the dominant narrative of the secularization of higher education, demonstrating how Campus Crusade helped reestablish evangelical Christianity as a visible subculture on American campuses. Beyond the campus, Bright expanded evangelicalism's influence in the worlds of business and politics. As Turner demonstrates, the story of Campus Crusade reflects the halting movement of evangelicalism into mainstream American society: its awkward marriage with conservative politics, its hesitancy over gender roles and sexuality, and its growing affluence.",,
66172,2590535,Morality After Auschwitz: The Radical Challenge of the Nazi Ethic,Peter J. Haas,0800608577,5.0,1988,12,1,Fortress Press (Philadelphia),5:1,4:0,3:0,2:0,1:0,total:1,1,en-US,267.0,Preface<br />Introduction<br />The Intellectual Matrix of an Ethic<br />The Growth of an Ethic<br />Ethics &amp; the Shaping of Social Institutions<br />Responding to an Ethic: The Loss of Evil<br />Afterwards: The Holocaust &amp; Us<br />Notes<br />Index<br />Acknowledgments,,
6418,1690826,Lilith,George MacDonald,0345017110,3.89,1971,3,12,"Ballantine Books, Inc. (NYC)",5:1914,4:1790,3:1206,2:419,1:149,total:5478,14,eng,,"First Ballantine Adult Fantasy Edition, 1969<br /><br />'<i>Lilith</i> is equal if not superior to the best of Poe' Wrote W.H Auden in his introduction to the 1954 reprint of George MacDonald's <i>Lilith</i>, first published in 1895.<br /><br />It is the story of Mr. Vane, an orphan and heir to a large house - a house in which he has a vision that leads him through a large old mirror into another world. In chronicling the five trips Mr. Vane makes to this other world, MacDonald hauntingly explores the ultimate mystery of evil.",274.0,14.0
76122,1708357,The Blood Spilt (Rebecka Martinsson #2),Åsa Larsson,0385340796,3.65,2007,26,12,Delta,5:1644,4:2918,3:2276,2:706,1:212,total:7756,21,eng,,"It’s midsummer in Sweden—when the light lingers through dawn and a long, isolating winter finally comes to an end. In this magical time, a brutal killer has chosen to strike. A female priest—who made enemies and acolytes in equal number—has been found hanging in her church. And a big-city lawyer quite acquainted with death enters the scene as police and parishioners try to pick up the pieces....<br /><br />Not long ago, attorney Rebecka Martinsson had to kill three men in order to stop an eerily similar murder spree—one that also involved a priest. Now she is back in Kiruna, the region of her birth, while a determined policewoman gnaws on the case and people who loved or loathed the victim mourn or revel in her demise. The further Rebecka is drawn into the mystery—a mystery that will soon take another victim—the more the dead woman’s world clutches her: a world of hurt and healing, sin and sexuality, and, above all, of sacrifice.<br /><br />In prose that is both lyrical and visceral, Åsa Larsson has crafted a novel of pure entertainment, a taut, atmospheric mystery that will hold you in thrall until the last, unforgettable page is turned<br /><br /><br /><i>From the Hardcover edition.</i>",368.0,
45425,862355,The Bone Detectives: How Forensic Anthropologists Solve Crimes and Uncover Mysteries of the Dead,Donna M. Jackson,0316829358,3.65,1996,1,4,"Little, Brown Books for Young Readers",5:20,4:26,3:28,2:6,1:3,total:83,3,en-US,,"It's said that ""dead men tell no tales"" -- yet their bones have some interesting stories to reveal. That's what police depend on when the only clues to a crime are the bones of the victim. Then it's time to call in the ""bone detectives."" <br />Following forensic anthropologist Dr. Michael Charney step-by-step through an investigation, this book shows how a person's sex, race, age, height, and weight can be determined from studying his or her bones and teeth; how markings on bones can be ""read"" to establish cause of death; how a sculptor uses clay to reconstruct a face from a skull so it can be publicized in the media and possibly recognized; and how all of this information can be used to help crack a case. <br />Curious young readers will revel in every eerie detail of award-winning journalist Donna Jackson's lively text and Charlie Fellenbaum's full-color photographs as they discover how these fascinating detectives help the stories behind the bones come to life.",48.0,3.0
632,1915342,"The Mammoth Encyclopedia of Modern Crime Fiction: The Authors, Their Works and Their Most Famous Creations",Mike Ashley,0786710063,3.73,2002,6,24,Running Press,5:6,4:8,3:5,2:2,1:1,total:22,1,eng,512.0,"Never before has there been a comprehensive, inexpensive reference guide and overview to the genre of crime fiction like The Mammoth Encyclopedia of Crime Fiction. Veteran editor Mike Ashley's historical introduction gives an overview of the crime genre, showing the background and development of crime fiction from the earliest days with Agatha Christie and Raymond Chandler through to the modern exponents of the craft such as Elmore Leonard and Ian Rankin. His A to Z covers five hundred entries on the major writers in the crime fiction field, from Edward S. Aarons to Mark Zubro, from the cult favorites to the best known, including Marjorie Allingham, Patricia Cornwell, Colin Dexter, Jim Thompson, and Minette Walters. The Mammoth Encyclopedia of Crime Fiction packs more information into its author entries than more expensive hardcover reference works. Each entry gives a brief biographical background with highlights for the cross-referenced key works, provides a full bibliography, and notes significant films/series adapted from their works. There are also added bonuses of a crime fiction glossary that defines the genre's special terms and expressions, such as ""hardboiled,"" ""impossible crime,"" and ""police procedural"" and four appendices covering key characters, key books and magazines, key films and TV series, and awards and award winners, including the Edgar Awards, the Dagger Awards, the Shamus Awards, and other important awards. Crime fiction buffs, mystery booksellers, and anyone interested in crime fiction will find The Mammoth Encyclopedia of Crime Fiction to be an indispensable reference and an unbeatable bargain.",,
