71658,2827276,Blind Promises,Katy Currie,0373786166,3.77,2008,3,25,Steeple Hill,5:338,4:317,3:287,2:113,1:25,total:1080,5,eng,217.0,"Fall in love with Diana Palmer's fan-favorite story, BLIND PROMISES!<br /><br />Dana Steele's new patient, Gannon van der Vere, is a tough customer. He had run off his last four nurses, but Dana's determined she won't be the next on that list. A powerful entrepreneur until a devastating accident left his future in doubt, Gannon raged at all who approached him. Dana hoped to light a candle in his darkness--and to escape from the shadows in her own past. But when she fell in love with her curmudgeonly employer, Dana's challenge was no longer strictly professional. Could Dana and Gannon heal to find a true happily-ever-after?",,
71802,2833823,"Talking to Dragons (Enchanted Forest Chronicles, #4)",Patricia C. Wrede,0807206393,4.19,2002,8,16,Listening Library,5:15430,4:10901,3:5791,2:1085,1:364,total:33571,1,eng,7.0,"One day, Daystar's mom, Cimorene, hands him a magic sword and kicks him out of the house. Daystar doesn't know what he is supposed to <i>do</i> with the magic sword, but knowing Cimorene, he's sure it must involve a dragon or two!<br />",,
65330,2558374,"The Hapsburg Monarchy among the Great Powers, 1815-1918",F.R. Bridge,0854963073,3.0,1990,12,7,Bloomsbury Academic,5:1,4:0,3:0,2:2,1:0,total:3,1,eng,417.0,"Written by a well-known specialist , this study on the Austro-Hungarian Empire is based on a wide variety of material from Austrian, British, French and German archives and takes into account recent work by other historians of the subject, particularly the latest Austrian studies. It is supplemented by useful maps and translations of key diplomatic documents of the period.<br />",,
80815,1843325,"Evil Breeding (A Dog Lover's Mystery, #12)",Susan Conant,0385486693,3.69,1999,3,16,Doubleday,5:82,4:105,3:120,2:26,1:5,total:338,2,eng,256.0,"When dog writer Holly Winter receives her first book contract, her research leads to some surprising--and deadly--discoveries.<br /><br />Holly Winter has a contract to write the text for a book of photographs commemorating the legendary Morris and Essex Dog Shows, canine extravaganzas produced by the fabulously wealthy and famously dog-obsessed Geraldine Rockefeller Dodge in the years leading up to World War II. Needless to say, Holly is delighted with the assignment, and immediately sets out to interview one of the few remaining people who actually attended one of the shows--B. Robert Motherway, a Princeton classmate of the Dodges' late son.<br /><br />It only takes one visit for Holly to realize that there is something strange going on in the Motherway household: a wife dying painfully in an upstairs bedroom, a daughter-in-law acting as a maid, a sullen son playing the role of kennel man, and--most distressing of all--a German shepherd that growls menacingly.<br /><br />Soon Holly begins to receive mysterious anonymous packages in the mail: a leaflet describing a popular dog medication, cryptic letters written in German, a couple of old photographs. Who could be sending them, and what do they mean? When Motherway's disagreeable son is found garroted in Mount Auburn Cemetery, the circumstances convince Holly that she must find the answers before she herself becomes the next victim.<br /><br />Evil Breeding presents an intriguingly complex puzzle and provides a wealth of fascinating information about a larger-than-life, legendary dog fancier.",,
103253,3326999,The Book of Dead Philosophers,Simon Critchley,0307390438,3.6,2009,2,10,Vintage Books,5:180,4:356,3:324,2:103,1:15,total:978,35,eng,265.0,"“To philosophize is to learn how to die.” —Cicero; assassinated by order of Mark Antony<br /><br />“One who no longer is cannot suffer.” —Lucretius; suicide, allegedly driven mad by a love potion<br /><br />“Life is solitary, poor, nasty, brutish, and short.” —Hobbes; died in bed, age 91<br /><br />In this collection of brief lives (and deaths) of nearly two hundred of the world's greatest thinkers, noted philosopher Simon Critchley creates a register of mortality that is tragic, amusing, absurd, and exemplary. From the self-mocking haikus of Zen masters on their deathbeds to the last words of Christian saints and modern-day sages, this irresistible book contains much to inspire both amusement and reflection. <br /><br />Informed by Critchley's acute insight, scholarly intelligence, and sprightly wit, each entry tells its own tale, but collected together they add up to a profound and moving investigation of meaning and the possibility of happiness for us all.",,
112944,4375030,Family Carers in Palliative Care: A Guide for Health and Social Care Professionals,Peter  Hudson,0199216908,0.0,2009,1,2,OUP Oxford,5:0,4:0,3:0,2:0,1:0,total:0,0,eng,309.0,"Support for the family is a key component of palliative care practice and philosophy, with both patient and family construed as the 'unit of care'. However, there is not always formal acknowledgement of the importance of the family carer role, or that of friends, neighbours and other non-professional, informal carers. Consequently, health and social care professionals find carer support work particularly challenging. Symptom management, personal care, and administering of medications are just some of the tasks taken on by this group of non-professionals, and the impact of this role can have negative emotional, physical, financial and social implications on the care-giver. Furthermore, family carers consistently report unmet needs, and there has been a lack of intervention studies aimed at improving carer support. <br />This book therefore provides an evidence-based, practical guide to enable health and social care professionals to assess and respond to family carer needs. It also explores the wider sociological, policy, and research issues related to family carers and palliative care.",,
28142,1327580,"The Queen from Provence (Plantagenet Saga, #6)",Jean Plaidy,0099510278,3.87,2008,7,2,Arrow,5:152,4:222,3:156,2:24,1:7,total:561,11,en-GB,,"Marguerite, eldest daughter of the Count of Provence, had married a king of France - and now her sister Eleanor is determined to make just as grand a match.<br /><br />Good fortune and wily cunning bring her Henry of England. A good and generous husband but a weak king, he rules a nation that still remembers his cruel and foolish father, King John. As Henry showers gifts on his new bride his extravagance forces him to levy ever greater taxation on the land, and the spectre of revolt soon looms against him. For Simon de Montfort, the adventurer who will give England its first true parliament, the house of destiny is at hand.",386.0,11.0
46298,873206,Mister Paradise and Other One-Act Plays,Tennessee Williams,0141188421,4.14,2006,30,3,Penguin Classics,5:31,4:36,3:17,2:1,1:0,total:85,2,eng,,"The greatest playwright of the American South, Tennessee Williams used his talent throughout his life to create brief plays exploring many of the themes that dominated his best-known works. Here, thirteen never-before-published one-act dramas reveal some of his most poignant and hilarious characters. From the indefatigable, witty and tough drag queens of And Tell Sad Stories of the Death of Queens to the disheartened poet Mister Paradise, and the extravagant mistress in The Pink Bedroom, these are tales of isolated figures struggling against a cruel world, who refuse to lose sight of their dreams.",245.0,2.0
2448,1966495,The Killing Art,Jonathan Santlofer,0060541075,3.67,2005,10,11,William Morrow,5:58,4:89,3:83,2:25,1:3,total:258,1,eng,384.0,"History and fiction collide with deadly consequences in the third Kate McKinnon novel—a story of bitter revenge, where the past invades the present and a decades-old secret proves fatal<br /><br />Kate McKinnon has lived many lives, from Queens cop to Manhattan socialite, television art historian, and the woman who helped the NYPD capture the Death Artist and the Color Blind killer. But that's the past. Now, devastated by the death of her husband, Kate is attempting to quietly rebuild her life as a single woman. Gone are the Park Avenue penthouse and designer clothes. Now it's a funky Chelsea loft, downtown fashion, and even a hip new haircut as Kate plunges back into her work—writing a book about America's most celebrated artistic era, the New York School of the 1940s and '50s, a circle that included Jackson Pollock, Willem de Kooning, and Mark Rothko.<br /><br />But when a lunatic starts slashing the very paintings she is writing about—along with their owners—Kate is once again tapped by the NYPD. As she deciphers the evidence—cryptic images that reveal both the paintings and the people who will be the next targets—Kate is drawn into a world where art and art history provide lethal clues.<br /><br /><i>The Killing Art</i> is Jonathan Santlofer's most gripping and chilling story yet, but that isn't the only reason the novel is remarkable. The author, who is also an acclaimed artist, has created works of art just for the book that tantalize and challenge readers by using well-known symbols in innovative ways, allowing them to decode the clues along with Kate. A masterwork of both suspense fiction and art, <i>The Killing Art</i> will impress both thriller readers and art fans as the plot twists and turns toward a shocking climax.",,
111186,4191602,The Western Front Illustrated: 1914-1918,John Laffin,0750914386,2.0,2004,4,23,Sutton Publishing,5:0,4:0,3:0,2:1,1:0,total:1,0,eng,192.0,With many illustrations this book provides the clearest and most dramatic impressions of World War I.,,
104231,3372529,"Payment In Blood (Inspector Lynley, #2)",Elizabeth  George,0553175114,4.01,1990,10,26,Bantam,5:5455,4:8199,3:3923,2:486,1:113,total:18176,5,eng,395.0,"The career of playwright Joy Sinclair comes to an abrupt end on an isolated estate in the Scottish Highlands when someone drives an eighteen-inch dirk through her neck. Called upon to investigate the case in a country where they have virtually no authority, aristocratic Detective Inspector Thomas Lynley and his partner, Detective Sergeant Barbara Havers, grapple for both a motive and a murderer. Emotions run deep in this highly charged drama, for the list of suspects soon includes Britain's foremost actress, its most successful theatrical producer, and the woman Lynley loves. He and Havers must tread carefully through the complicated terrain of human relationships, while they work to solve a case rooted in the darkest corners of the past and the unexplored regions of the human heart.",,
6848,702384,The Best of Laxman: The Common Man Casts His Vote,R.K. Laxman,0143032690,4.29,2005,1,7,"Penguin Books,India",5:7,4:4,3:3,2:0,1:0,total:14,2,eng,,"From financial crises to the woes of householders, from political instability to rampant corruption, Laxman's cartoons capture the entire gamut of contemporary Indian experience. Hilarious and thought provoking at the same time, this is a treasure house of humor from one of the most striking voice commenting on Indian socio-political life today.",200.0,2.0
94789,1195113,"Lost (Fearless, #25)",Francine Pascal,0689855516,3.93,2003,1,1,Simon Pulse,5:150,4:151,3:119,2:22,1:6,total:448,6,eng,,"Now that things are insane again they’re finally back to normal. Dad’s in a coma. And I’m going out of my mind. Oh, one more thing…<br /><br />Sam’s back from the dead.",224.0,6.0
31397,1500830,Motor City Dream Garages: Amazing Collections from America's Greatest Car City,Rex  Roy,0760329893,3.75,2007,15,11,Motorbooks,5:2,4:0,3:1,2:1,1:0,total:4,1,eng,,"There isn't another place in the world that can match Detroit's automotive history. For nearly a century, what was conceived, designed, produced, and marketed from this town ruled the roads. So it only stands to reason that the Motor City is likely to host some of the country's greatest collector garages.<br /><br />From the personal home of the man who put America on wheels to the posh residences of current automotive icons such as Bob Lutz, <em>Motor City Dream Garages</em> takes readers on a guided tour of 20-plus of Motown's most interesting garages. Going beyond even these fantastic garagemahals, this book also takes readers inside select company garages for exclusive looks at the unique and important collections amassed by companies such as General Motors and Roush Industries (parent company to Roush Racing, owned by Jack Roush).<br /><br />If you like both garages and the beautiful machines within, this book is for you!",192.0,1.0
75718,2993119,The Reasons of Love,Harry G. Frankfurt,0691091641,3.65,2004,1,25,Princeton University Press,5:85,4:124,3:100,2:34,1:14,total:357,2,eng,112.0,"This beautifully written book by one of the world's leading moral philosophers argues that the key to a fulfilled life is to pursue wholeheartedly what one cares about, that love is the most authoritative form of caring, and that the purest form of love is, in a complicated way, self-love.<br /><br /><br /> Harry Frankfurt writes that it is through caring that we infuse the world with meaning. Caring provides us with stable ambitions and concerns; it shapes the framework of aims and interests within which we lead our lives. The most basic and essential question for a person to raise about the conduct of his or her life is not what he or she should care about but what, in fact, he or she cannot help caring about.<br /><br /><br /> The most important form of caring, Frankfurt writes, is love, a nonvoluntary, disinterested concern for the flourishing of what is loved. Love is so important because meaningful practical reasoning must be grounded in ends that we do not seek only to attain other ends, and because it is in loving that we become bound to final ends desired for their own sakes.<br /><br /><br /> Frankfurt argues that the purest form of love is self-love. This sounds perverse, but self-love--as distinct from self-indulgence--is at heart a disinterested concern for whatever it is that the person loves. The most elementary form of self-love is nothing more than the desire of a person to love. Insofar as this is true, self-love is simply a commitment to finding meaning in our lives.",,
78895,1793726,"Early Greek Myth: A Guide to Literary and Artistic Sources, Volume 2",Timothy Gantz,0801853621,4.46,1996,19,6,Johns Hopkins University Press,5:30,4:2,3:8,2:0,1:1,total:41,0,eng,,<i>Early Greek Myth</i> is a much-needed handbook for scholars and others interested in the literary and artistic sources of archaic Greek myths—and the only one of its kind available in English. Timothy Gantz traces the development of each myth in narrative form and summarizes the written and visual evidence in which the specific details of the story appear.,424.0,
98782,3142245,Hegel's Idea of Freedom,Alan Patten,0199251568,3.67,2002,5,23,"Oxford University Press, USA",5:2,4:2,3:0,2:2,1:0,total:6,0,eng,232.0,"This book offers the first full-length treatment in English of Hegel's idea of freedom - his theory of what it is to be free and his account of the social and political contexts in which this freedom is developed, realized, and sustained. Freedom is the value that Hegel most greatly admired and the central organizing concept of his social philosophy.<br />",,
97908,3107622,Good Housekeeping Complete Cook's Book,Christine Ingram,0007100744,0.0,2000,9,4,HarperCollins Illustrated,5:0,4:0,3:0,2:0,1:0,total:0,0,eng,304.0,"A highly illustrated comprehensive cookery manual that will teach its readers every thing they need to know about how to be successful in the kitchen.<br /><br />Chapter One: Essential Know How outlines the enormous range of equipment available and details the best buys. It distinguishes the must-haves from the less essential items of equipment, enabling readers to create well-stocked yet efficient kitchens. Included in this information will be care and cleaning tips and the know-how necessary to use both familiar and specialist items. Detailed information is provided on the different techniques used to produce sweet and savoury dishes, such as roasting, sealing, beating, blanching and poaching. Step-by-step photographs and easy-to-follow instructions illustrate the method of each technique while helpful tips ensure that common pitfalls are avoided and offer logical solutions to the most frequently encountered cookery problems.<br /><br />Chapter Two: Ingredients is devoted to individual ingredients, from dairy products such as milk and cheese through to meats, fish and poultry and then to vegetables, noodles and grains and finally to flavourings such as chocolate and sugar. All ingredients are illustrated and described in detail with advice on the cookery terms and techniques associated with each.<br /><br />Finally, a collection of 120 classic recipes offer an invaluable resource for cooks of all levels. These are cross referenced throughout the rest of the book and to ensure complete reliability, all the recipes have been tested in the Good Housekeeping Institute kitchens. Vital information on preparation and cooking times, freezing notes and a calorie count are also provided.<br /><br />A soon-to-be classic work of food reference, the Complete Cook’s Book is packed with important, enlightening and eye-opening culinary information – something that no ordinary cookbook can deliver.",,
68066,2669088,The Forger: An Extraordinary Story of Survival in Wartime Berlin,Cioma Schönhaus,0786720581,3.8,2008,1,8,"Da Capo Press (Cambridge, MA)",5:101,4:148,3:115,2:22,1:7,total:393,43,eng,235.0,"In Nazi Germany, 20-year-old graphic artist Cioma Schönhaus found a unique outlet for his talent: he forged documents for people fleeing the Reich, ultimately helping to save hundreds of lives. Yet, even as the Gestapo posted his photo in public, he lived a daring life, replete with fine restaurants &amp; beautiful women, all the while managing to elude the Nazis. Breathtakingly bold, Schönhaus talked his way out of an arrest, defended Jewish diners being harassed by the police, &amp; ultimately fled Germany by bicycling to Switzerland. Schönhaus’ story--his courageous exploits that saved so many, as many others around him were deported, one by one, to the concentration camps--is an astonishing tale of wartime heroism &amp; survival.",,
82577,1896340,Texts and Cultural Change in Early Modern England,Cedric C. Brown,0333662873,3.33,1997,10,15,Palgrave MacMillan,5:1,4:0,3:1,2:1,1:0,total:3,0,eng,254.0,"This is a wide-ranging, closely-researched collection, written by scholars from both sides of the Atlantic, on the cultural placement and transmission of texts between 1520 and 1750. Material and historical conditions of texts are analysed, and the range of works is wide, including plays and the Lucrece of Shakespeare (with adaptations, and a discussion of 'reading' playtexts), Sidney's Arcadia, Greene's popular Pandosto (both discussed in the contexts of changing readerships and forms of fiction), Hakluyt's travel books, funerary verse, and the writings of Katherine Parr and Elizabethan Catholic martyrs.",,
91309,1131591,"Dark Assassin (William Monk, #15)",Anne Perry,075532059X,3.98,2006,4,9,Headline,5:874,4:1346,3:694,2:85,1:27,total:3026,3,eng,,"<i>The two figures had been on the bridge. He had grasped hold of her. To save her, or to push her?</i><br /><br />Inspector William Monk is still feeling his way in a new post in the Thames River Police and knows he must solve the mystery to gain the respect of his men. Soon both he and Hester find themselves powerfully involved in the story of the dead woman, Mary Havilland, and her quest to vindicate her father, found dead two months previously. An engineer working for the Argyll Construction Company, James Havilland was convinced a major disaster would happen in the tunnels where London's desperately needed new sewer system was being built. Maddened by his obsession, he'd apparently shot himself. Mary had never accepted that and now she was dead too. Was it chance or something more sinister?",378.0,3.0
39783,1293595,"The Lazarus Strain (Dr Steven Dunbar, #6)",Ken McClure,0749080159,3.88,2007,1,8,Allison & Busby,5:120,4:202,3:100,2:29,1:6,total:457,30,en-GB,,"When the Crick Research Institute is broken into the police believe that it was Animal Rights activists taking things a step too far. But one of the Institute's top scientists, Tim Devon, is found brutally murdered and six research monkeys have been let loose. No one seems to know exactly what the monkeys were being used for and government officials arrive a little too promptly to prevent any of Prof. Devon's colleagues from finding out exactly what he was researching.",317.0,30.0
40306,802241,Sharks,Catriona Clarke,0794515819,3.99,2007,1,1,Usborne Books,5:28,4:25,3:18,2:4,1:1,total:76,9,eng,,What do sharks like to eat? Which shark glows in the dark? And why do some sharks never stop swimming? Youll find out the answers and lots more fun facts in this shark-infested book.,32.0,9.0
51655,2092973,Me And Mr Darcy,Alexandra Potter,0340923741,3.22,2007,6,28,Hodder,5:2006,4:2981,3:4403,2:2348,1:928,total:12666,114,eng,352.0,"He's every woman's fantasy...<br /><br />After a string of disastrous relationships, Emily Albright has had it with modern men.<br /><br />She'd rather curl up with <i>Pride and Prejudice</i> and step into a time where men were honorable and strode across fields in breeches, their damp shirts clinging to their chests. The men she meets are more into pleated trousers, two-timing and internet porn.<br /><br />So when her best friend invites her to Mexico for a week of margaritas and manhunting, Emily books a guided tour of Jane Austen country instead.<br /><br />There are no dream men here. The coach is full of pensioners, apart from one Spike Hargreaves, a foul-tempered journalist writing a piece on why most women would love to date Mr Darcy.<br /><br />But then she walks into a room and finds herself face-to-face with Darcy himself. And every woman's fantasy suddenly becomes one woman's reality...<br /><br />Alexandra Potter makes dreams come true in this fun, feel-good fairy-tale about life, love and dating literature's most eligible bachelor.",,
50887,2069496,"Tasha the Tap Dance Fairy (Rainbow Magic: Dance Fairies, #4)",Daisy Meadows,1846164931,3.85,2007,8,1,Orchard (NY),5:239,4:133,3:138,2:53,1:27,total:590,19,eng,69.0,"Rachel and Kirsty are on the hunt for Tasha's magic ribbon. Its been stolen by a goblin, who thinks he's brilliant at tap dancing! Can the girls find a way to trick the nasty goblin into giving the ribbon back.",,
97534,3092139,Apricots At Midnight: And Other Stories From A Patchwork Quilt,Adèle Geras,0006732259,4.5600000000000005,1989,5,11,Young Lions,5:47,4:26,3:4,2:0,1:0,total:77,0,eng,192.0,"Long ago, when Aunt Pinny was small, she wanted a garden. but it was winter and she was ill, so she has to have a special sort of garden, a garden of silk and velvet and lace, all sewn into a wonderful patchwork quilt.<br /><br />Each patch has a story to tell. The red velvet brings back memories of the fancy dress ball, where Pinny had a midnight feast with a highwayman, and the green brocade with the blue dragons reminds her of Captain Tramplemousse, the pirate. Then there's the stripey patch from a zebra and a piece of lace from a haunted dress, and many more, all with tales from an enchanted childhood in a bygone age.",,
8053,720525,60 Crocheted Snowflakes,Barbara Christopher,0486253937,3.91,1987,1,7,Dover Publications,5:25,4:16,3:17,2:4,1:2,total:64,2,eng,,"Few objects evoke the spirit of Christmas and a holiday atmosphere more effectively than light and airy snowflakes. Now, with this unusually extensive and comprehensive collection of patterns, crocheters can add exquisitely shaped ""snow gems"" to their treasure chest of festive ornaments.<br />Delicate snowflake patterns, infinite in form and amazingly symmetrical, are among the most popular designs with today's needleworkers. The 60 motifs in this collection, based on photographs of actual snowflakes from the book <i>Snow Crystals</i> by W. A. Bentley and W. L. J. Humphreys, include simple shapes for beginners, as well as intricate and challenging motifs for the more advanced. Eye-catching patterns include star-shaped wheels, exotic flower-like webs, six-side jewels of intricately worked threads, and a kaleidoscope of lacy arms and elaborate fern-like compositions.<br />Ideal for decorating Christmas trees, windows, and packages, or for framing, the snowflake patterns included here come with complete directions and finely detailed illustrations; and unlike nature's fragile, short-lived crystals, these inexpensive ornaments will be a joy to behold for years to come.",32.0,2.0
95360,3010560,"Sacred Stone (The Oregon Files, #2)",Clive Cussler,1587248751,3.96,2005,1,1,Wheeler Publishing,5:2820,4:3284,3:1987,2:393,1:121,total:8605,0,eng,551.0,"<b>A New York Times Bestselling Author</b><br /><br />In the remote wastes of Greenland, an ancient artifact possessing catastrophic radioactive power is unearthed. Caught between two militant factions, Juan Cabrillo and his network of spies must fight to protect the outbreak of World War III.",,
107560,3581328,Superman: Brainiac,Geoff Johns,1401220878,4.02,2009,3,10,DC Comics,5:1110,4:1136,3:673,2:160,1:22,total:3101,114,eng,128.0,"Before he came to Earth, the people of Superman's homes planet Krypton had battled Brainiac, a cold and callous alien obsessed with the control of knowledge. <br /><br />Now, Brainiac has set his sights on destroying Earth and finishing off the Last Son of Krypton once and for all. This epic battle will change Superman's world forever.<br /><br />Collecting ACTION COMICS #866-870 and material from SUPERMAN: NEW KRYPTON SPECIAL #1.",,
